{"declared_gaps":[{"first":"2","last":"2"}],"first_sequence":"1","last_sequence":"4","leaves":[{"receipt_digest":"sha256:1111111111111111111111111111111111111111111111111111111111111111","sequence":"1"},{"receipt_digest":"sha256:2222222222222222222222222222222222222222222222222222222222222222","sequence":"3"},{"receipt_digest":"sha256:3333333333333333333333333333333333333333333333333333333333333333","sequence":"4"}],"receipt_count":"3"}